{
  "schema_version": 1,
  "project_id": "project-1",
  "operation_id": "learning-example",
  "event_digest": "aaaaaaaaaaaaaaaaaaaaaaaaaaaaaaaaaaaaaaaaaaaaaaaaaaaaaaaaaaaaaaaa",
  "ticket": {
    "run_id": "observe-1",
    "request_id": "request-1",
    "revision": 1,
    "base_timeline_version": 0,
    "authorization_generation": 0,
    "cancellation_generation": 0,
    "authorization_digest": "cccccccccccccccccccccccccccccccccccccccccccccccccccccccccccccccc",
    "input_digest": "dddddddddddddddddddddddddddddddddddddddddddddddddddddddddddddddd",
    "profile": null
  },
  "permit": {
    "profile_id": "profile-example",
    "consent_generation": 1,
    "deletion_generation": 0,
    "provider": "fixture",
    "source": {
      "source_project_id": "project-1",
      "source_event_id": "learning-example",
      "content_digest": "aaaaaaaaaaaaaaaaaaaaaaaaaaaaaaaaaaaaaaaaaaaaaaaaaaaaaaaaaaaaaaaa",
      "data_type": "history_reference",
      "evidence_refs": [
        "fact-example"
      ],
      "correction_digest": null
    },
    "correction": null
  },
  "created_at": "2026-09-24T00:00:00Z"
}
